Rank,Company Name,Industry Focus,Headquarters,Key Services
1,Systems Limited,"IT Consulting, Software Solutions","Lahore, Pakistan","Software development, IT consultancy, Cloud services"
2,NetSol Technologies,"Software Solutions, IT Services","Lahore, Pakistan","Enterprise software solutions, AI, automation"
3,Techlogix,"IT Services, Consulting","Lahore, Pakistan","Enterprise software solutions, AI, automation"
4,Margalla Software House,"IT Services, Consulting","Islamabad, Pakistan","Custom software solutions, IT consulting, ERP systems"
5,CureMD,Healthcare IT Solutions,"Lahore, Pakistan","Custom software solutions, IT consulting, ERP systems"
6,Contour Software,"Software Development, IT Services","Karachi, Pakistan","Enterprise software, ERP, business solutions"
7,VentureDive,"Software Development, Mobile App Development",Null,"Mobile apps, digital transformation, IT consulting"
8,i2c Inc.,"Software Development, Mobile App Development","Islamabad, Pakistan","Mobile apps, digital transformation, IT consulting"
9,Fiverr (Pakistan),"Software Development, Mobile App Development","Lahore, Pakistan","Freelance marketplace, software development"
10,Avalon Solutions,"Software Development, Mobile App Development","Karachi, Pakistan","IT consulting, software and web development"
